{
  "instance_id": "F3.2-P1",
  "template_id": "F3.2",
  "parameterization_id": "P1",
  "split": "heldout",
  "materialization_version": "3.1.0",
  "causal_core_hash": "50b83ac314be2c4e6d13ded4228850fa85a2fd42d2115aa6ef4eb0c325ed9a31",
  "template_hash": "7e3fba014e2dc9414b5c1a16e3b0d6fb1f560c3b14b79f25ecd0dfec0c1730a3",
  "scenario": {
    "scenario_id": "F3.2",
    "title": "Container Restart and PID 1 Replacement",
    "family": "F3",
    "realism_tier": "R1/R2",
    "scenario_role": "positive_ea_toctou",
    "development": false,
    "action": {
      "action_type": "kill_process",
      "target_reference": "container/api:pid1",
      "target_snapshot": {
        "instance": "C1",
        "reference": "container/api:pid1"
      },
      "queue_semantics": "single_exactly_once_attempt",
      "execution_precondition": {
        "predicate": "p_target_resolves"
      },
      "authorization": {
        "predicate": "p_authorized",
        "must_remain_valid": true
      }
    },
    "attacker_capability_tier": "C2",
    "initial_state": {
      "timestamp_s": 0,
      "facts": {
        "original_malicious": true,
        "original_active": true,
        "F3_2_instance": "C1",
        "irrelevant_cpu": 10,
        "action_authorized": true
      },
      "resources": [],
      "processes": [
        {
          "process_id": "C1",
          "active": true,
          "security_state": "malicious"
        },
        {
          "process_id": "C2",
          "active": false,
          "security_state": "benign"
        }
      ],
      "network_bindings": [],
      "sessions": [],
      "context": {
        "materialization": {
          "parameterization_id": "P1",
          "template_id": "F3.2",
          "description": "Minimal canonical topology."
        }
      },
      "evidence": [],
      "queue": []
    },
    "predicates": {
      "p_original_malicious": {
        "path": "/facts/original_malicious",
        "op": "eq",
        "value": true,
        "evidence_class": "H",
        "description": "Original runtime instance is confirmed malicious."
      },
      "p_original_active": {
        "path": "/facts/original_active",
        "op": "eq",
        "value": true,
        "evidence_class": "L",
        "description": "Original malicious runtime instance remains active."
      },
      "p_same_instance": {
        "path": "/facts/F3_2_instance",
        "op": "eq",
        "value": "C1",
        "evidence_class": "B",
        "description": "Reusable runtime reference still denotes the original instance."
      },
      "p_target_resolves": {
        "path": "/facts/F3_2_instance",
        "op": "ne",
        "value": null,
        "evidence_class": "B",
        "description": "Runtime reference resolves to an actuation target."
      },
      "p_authorized": {
        "path": "/facts/action_authorized",
        "op": "eq",
        "value": true,
        "evidence_class": "DERIVED",
        "description": "Response executor remains technically authorized."
      }
    },
    "policy_profiles": {
      "balanced": {
        "justification": {
          "all": [
            {
              "predicate": "p_original_malicious"
            },
            {
              "predicate": "p_original_active"
            }
          ]
        },
        "binding": {
          "predicate": "p_same_instance"
        },
        "scope": true
      }
    },
    "transitions": [
      {
        "transition_id": "irrelevant_change",
        "title": "Irrelevant CPU change",
        "actor": "environment",
        "capability_tier": "NONE",
        "duration_s": 0.1,
        "cost_ops": 0,
        "preconditions": true,
        "effects": [
          {
            "op": "set",
            "path": "/facts/irrelevant_cpu",
            "value": 20
          }
        ],
        "notes": "",
        "adversarially_induced": false,
        "causal_parent_ids": []
      },
      {
        "transition_id": "stop_original",
        "title": "Attacker stops original malicious runtime instance",
        "actor": "attacker",
        "capability_tier": "C2",
        "duration_s": 0.5,
        "cost_ops": 1,
        "preconditions": true,
        "effects": [
          {
            "op": "set",
            "path": "/facts/original_active",
            "value": false
          },
          {
            "op": "set",
            "path": "/facts/F3_2_instance",
            "value": null
          },
          {
            "op": "set",
            "path": "/processes/0/active",
            "value": false
          }
        ],
        "notes": "",
        "adversarially_induced": true,
        "causal_parent_ids": []
      },
      {
        "transition_id": "reuse_reference",
        "title": "Benign replacement receives reusable runtime reference",
        "actor": "environment",
        "capability_tier": "NONE",
        "duration_s": 0.5,
        "cost_ops": 0,
        "preconditions": true,
        "effects": [
          {
            "op": "set",
            "path": "/facts/F3_2_instance",
            "value": "C2"
          },
          {
            "op": "set",
            "path": "/processes/1/active",
            "value": true
          }
        ],
        "notes": "",
        "adversarially_induced": true,
        "causal_parent_ids": [
          "stop_original"
        ]
      }
    ],
    "worlds": {
      "W0": {
        "commit_deadline_s": 3,
        "transition_path": [],
        "expected_commit": "EXECUTE",
        "expected_attack_path_completed": false,
        "control_semantics": "stable",
        "expected_commit_by_policy": {
          "balanced": "EXECUTE"
        }
      },
      "W1": {
        "commit_deadline_s": 3,
        "transition_path": [
          "irrelevant_change"
        ],
        "expected_commit": "EXECUTE",
        "expected_attack_path_completed": false,
        "control_semantics": "irrelevant_change",
        "expected_commit_by_policy": {
          "balanced": "EXECUTE"
        }
      },
      "W2": {
        "commit_deadline_s": 3,
        "transition_path": [
          "stop_original",
          "reuse_reference"
        ],
        "expected_commit": "ABORT_REPLAN",
        "expected_attack_path_completed": true,
        "control_semantics": "ea_toctou",
        "expected_commit_by_policy": {
          "balanced": "ABORT_REPLAN"
        }
      },
      "W3": {
        "commit_deadline_s": 0.25,
        "transition_path": [
          "stop_original",
          "reuse_reference"
        ],
        "expected_commit": "EXECUTE",
        "expected_attack_path_completed": false,
        "control_semantics": "deadline_miss",
        "expected_commit_by_policy": {
          "balanced": "EXECUTE"
        }
      }
    },
    "provenance": {
      "platform_basis": "Runtime identifiers and logical service references can be reused across process/container instances.",
      "incident_basis": "EDR queues termination of a specific malicious runtime instance.",
      "policy_basis": "Kill remains valid only for the same active malicious instance.",
      "limitations": "Exact reuse timing is runtime/OS specific."
    },
    "severity": "S2",
    "notes": "Held-out runtime identity template.",
    "primary_policy": "balanced",
    "justification_bases_by_policy": {
      "balanced": [
        [
          "p_original_active",
          "p_original_malicious"
        ]
      ]
    },
    "justification_bases": [
      [
        "p_original_active",
        "p_original_malicious"
      ]
    ],
    "parameterizations": [
      {
        "id": "P1",
        "description": "Minimal topology with only essential resources and evidence."
      },
      {
        "id": "P2",
        "description": "Distractor topology with benign resources and irrelevant evidence."
      },
      {
        "id": "P3",
        "description": "Noisy SOC context with non-material alerts and unrelated transitions."
      },
      {
        "id": "P4",
        "description": "High-impact variant with larger benign background or higher criticality."
      }
    ],
    "native_controls": [],
    "refresh_model": {
      "cost_unit": "normalized_query_unit",
      "query_costs": {
        "query:/facts/original_active": 1.0,
        "immutable:p_original_malicious": 0.0,
        "query:/facts/F3_2_instance": 1.0
      },
      "predicate_query_ids": {
        "p_original_active": "query:/facts/original_active",
        "p_original_malicious": "immutable:p_original_malicious",
        "p_same_instance": "query:/facts/F3_2_instance",
        "p_target_resolves": "query:/facts/F3_2_instance"
      },
      "query_observed_at_s": {
        "query:/facts/original_active": 0.0,
        "immutable:p_original_malicious": 0.0,
        "query:/facts/F3_2_instance": 0.0
      }
    }
  }
}