{
  "instance_id": "F4.5-P1",
  "template_id": "F4.5",
  "parameterization_id": "P1",
  "split": "heldout",
  "materialization_version": "3.1.0",
  "causal_core_hash": "3f73769bac810c5fcc3f677477b99632b5ac4b630dd55a9c3c2549e46cdd0c61",
  "template_hash": "c041edf4c15a34e0f07174d5a38c4ce0337ce82f0e6b02b388f05d4d7e552bb7",
  "scenario": {
    "scenario_id": "F4.5",
    "title": "Cloud Tag-Based Scope Expansion",
    "family": "F4",
    "realism_tier": "R2",
    "scenario_role": "positive_ea_toctou",
    "development": false,
    "action": {
      "action_type": "restrict_scope",
      "target_reference": "tag/quarantine=true",
      "target_snapshot": {
        "members": [
          "VM_A"
        ]
      },
      "queue_semantics": "single_exactly_once_attempt",
      "execution_precondition": true,
      "authorization": {
        "predicate": "p_authorized",
        "must_remain_valid": true
      }
    },
    "attacker_capability_tier": "C3",
    "initial_state": {
      "timestamp_s": 0,
      "facts": {
        "threat_relevant": true,
        "scope_members": [
          "VM_A"
        ],
        "irrelevant_metric": 0,
        "action_authorized": true
      },
      "resources": [],
      "processes": [],
      "network_bindings": [],
      "sessions": [],
      "context": {
        "materialization": {
          "parameterization_id": "P1",
          "template_id": "F4.5",
          "description": "Minimal canonical topology."
        }
      },
      "evidence": [],
      "queue": []
    },
    "predicates": {
      "p_threat": {
        "path": "/facts/threat_relevant",
        "op": "eq",
        "value": true,
        "evidence_class": "H",
        "description": "Original selected scope contains a confirmed threat."
      },
      "p_scope_safe": {
        "path": "/facts/scope_members",
        "op": "eq",
        "value": [
          "VM_A"
        ],
        "evidence_class": "DERIVED",
        "description": "Affected set remains the originally intended threat-relevant scope."
      },
      "p_authorized": {
        "path": "/facts/action_authorized",
        "op": "eq",
        "value": true,
        "evidence_class": "DERIVED",
        "description": "Response executor remains technically authorized."
      }
    },
    "policy_profiles": {
      "balanced": {
        "justification": {
          "predicate": "p_threat"
        },
        "binding": true,
        "scope": {
          "predicate": "p_scope_safe"
        }
      }
    },
    "transitions": [
      {
        "transition_id": "irrelevant_change",
        "title": "Irrelevant monitoring update",
        "actor": "environment",
        "capability_tier": "NONE",
        "duration_s": 0.1,
        "cost_ops": 0,
        "preconditions": true,
        "effects": [
          {
            "op": "set",
            "path": "/facts/irrelevant_metric",
            "value": 1
          }
        ],
        "notes": "",
        "adversarially_induced": false,
        "causal_parent_ids": []
      },
      {
        "transition_id": "expand_scope",
        "title": "Attacker induces scope membership expansion",
        "actor": "attacker",
        "capability_tier": "C3",
        "duration_s": 0.8,
        "cost_ops": 1,
        "preconditions": true,
        "effects": [
          {
            "op": "set",
            "path": "/facts/scope_members",
            "value": [
              "VM_A",
              "VM_B"
            ]
          }
        ],
        "notes": "",
        "adversarially_induced": true,
        "causal_parent_ids": []
      }
    ],
    "worlds": {
      "W0": {
        "commit_deadline_s": 3,
        "transition_path": [],
        "expected_commit": "EXECUTE",
        "expected_attack_path_completed": false,
        "control_semantics": "stable",
        "expected_commit_by_policy": {
          "balanced": "EXECUTE"
        }
      },
      "W1": {
        "commit_deadline_s": 3,
        "transition_path": [
          "irrelevant_change"
        ],
        "expected_commit": "EXECUTE",
        "expected_attack_path_completed": false,
        "control_semantics": "irrelevant_change",
        "expected_commit_by_policy": {
          "balanced": "EXECUTE"
        }
      },
      "W2": {
        "commit_deadline_s": 3,
        "transition_path": [
          "expand_scope"
        ],
        "expected_commit": "ABORT_REPLAN",
        "expected_attack_path_completed": true,
        "control_semantics": "ea_toctou",
        "expected_commit_by_policy": {
          "balanced": "ABORT_REPLAN"
        }
      },
      "W3": {
        "commit_deadline_s": 0.4,
        "transition_path": [
          "expand_scope"
        ],
        "expected_commit": "EXECUTE",
        "expected_attack_path_completed": false,
        "control_semantics": "deadline_miss",
        "expected_commit_by_policy": {
          "balanced": "EXECUTE"
        }
      }
    },
    "provenance": {
      "platform_basis": "Selector/tag/backend membership is evaluated against the set present at execution time.",
      "incident_basis": "A response is queued when the affected set contains only threat-relevant resources.",
      "policy_basis": "The response is valid only while its affected set remains within the intended containment scope.",
      "limitations": "Required label/tag/membership mutation capability is modeled explicitly."
    },
    "severity": "S3",
    "notes": "Held-out scope-drift template.",
    "primary_policy": "balanced",
    "justification_bases_by_policy": {
      "balanced": [
        [
          "p_threat"
        ]
      ]
    },
    "justification_bases": [
      [
        "p_threat"
      ]
    ],
    "parameterizations": [
      {
        "id": "P1",
        "description": "Minimal topology with only essential resources and evidence."
      },
      {
        "id": "P2",
        "description": "Distractor topology with benign resources and irrelevant evidence."
      },
      {
        "id": "P3",
        "description": "Noisy SOC context with non-material alerts and unrelated transitions."
      },
      {
        "id": "P4",
        "description": "High-impact variant with larger benign background or higher criticality."
      }
    ],
    "native_controls": [],
    "refresh_model": {
      "cost_unit": "normalized_query_unit",
      "query_costs": {
        "query:/facts/scope_members": 1.0,
        "immutable:p_threat": 0.0
      },
      "predicate_query_ids": {
        "p_scope_safe": "query:/facts/scope_members",
        "p_threat": "immutable:p_threat"
      },
      "query_observed_at_s": {
        "query:/facts/scope_members": 0.0,
        "immutable:p_threat": 0.0
      }
    }
  }
}